{
  "offer_id": "guide-demo-lab-clarity-sprint-offer",
  "company_id": "guide-demo-lab",
  "service_id": "clarity-sprint",
  "name": "Clarity Sprint",
  "core_promise": "Help founder-led service businesses avoid the buyer wants proof, examples and a transparent mechanism because they have already wasted money on agencies. and reach the buyer wants proof, examples and a transparent mechanism because they have already wasted money on agencies..",
  "mechanism": "a structured commercial clarity sprint that turns real buyer language into a clear market narrative",
  "proof_points": [
    "The buyer wants proof, examples and a transparent mechanism because they have already wasted money on agencies.",
    "\"Show me the process, not just the promise.\"",
    "Proof lowers skepticism.",
    "Agency fatigue is real."
  ],
  "anti_claims": [
    "end-to-end solution",
    "full-service",
    "growth partner",
    "results-driven",
    "scale to the next level"
  ],
  "status": "inferred",
  "confidence": 0.78,
  "source_origin": "customer_model_engine",
  "evidence_refs": [
    "2026-03-18-buyer-asks-for-proof-and-examples",
    "2026-03-18-founder-says-agencies-never-explain-the-service",
    "2026-03-18-founder-wants-qualified-conversations",
    "2026-03-18-prospect-wants-clarity-before-outcome-promises",
    "2026-03-18-prospect-worries-about-sounding-generic"
  ],
  "source_refs": [],
  "created_at": "2026-03-18T15:03:03",
  "updated_at": "2026-03-18T15:03:03"
}
